{
  "schema_version": 1,
  "config_id": "microsoft",
  "status": "active",
  "comments": "Externally maintained Microsoft configuration for the first materialization slice.",
  "firm": {
    "id": "microsoft",
    "display_name": "Microsoft",
    "legal_name": "Microsoft Corporation",
    "subtitle": "Cloud, software, and platform operator",
    "priority": 90,
    "valid_from": "2020-01-01",
    "jurisdiction": "Washington, United States",
    "headquarters": "Redmond, Washington, United States",
    "sector": "Information Technology",
    "industry": "Software",
    "aliases": ["MSFT"],
    "identifiers": [
      {"kind": "ticker", "value": "MSFT", "market": "NASDAQ"},
      {"kind": "cik", "value": "0000789019", "market": "SEC"}
    ],
    "domains": ["microsoft.com"],
    "technology_focus": ["cloud computing", "enterprise software", "artificial intelligence"],
    "source_hints": [
      {
        "kind": "investor-relations",
        "value": "https://www.microsoft.com/en-us/Investor/",
        "comments": "Operator orientation only; not retrieved provenance."
      }
    ],
    "comments": "Authoritative firm configuration comments remain uninterpreted text."
  },
  "sources": {
    "sec": {
      "enabled": true,
      "cik": "0000789019",
      "registrant_name": "MICROSOFT CORP",
      "filing_regime": "domestic",
      "verification": {
        "status": "verified",
        "verified_at": "2026-07-27T00:00:00+00:00",
        "source": "SEC EDGAR submissions identity"
      },
      "artifacts": ["sec_10k", "sec_10q", "sec_8k"],
      "comments": "Runtime endpoints, accessions, and filing URLs are deliberately omitted."
    },
    "earnings_transcript": {
      "enabled": true,
      "listing_urls": ["https://www.microsoft.com/en-us/investor/events"],
      "allowed_hosts": ["www.microsoft.com"],
      "comments": "Official issuer earnings page listing the call transcript."
    }
  }
}
